{
  "$schema": "https://specs.miyunadev.org/schemas/v1/plugin.schema.json",
  "id": "org.miyunadev.test.minimal",
  "name": "Minimal Valid Plugin",
  "version": "1.0.0",
  "author": {
    "name": "Miyuna Contributor"
  },
  "engines": {
    "miyuna": ">=1.0.0 <2.0.0"
  },
  "artifact": {
    "type": "web-bundle",
    "entry": "dist/index.html"
  }
}
